{
  "version": "1.1.0",
  "updated_at": "2026-10-25T17:15:00+05:30",
  "changelog": [
    {
      "at": "2026-10-04T00:00:00+05:30",
      "by": "agent",
      "change": "initial campaigns from 08_MCP_ACQUISITION_ENGINE.md §3",
      "reason": "launch"
    },
    {
      "at": "2026-10-11T05:50:00+00:00",
      "by": "aryan",
      "change": "set campaign priority order so mcp-integrations and ai-agents run before rag-knowledge",
      "reason": "15-search cap was starving later campaigns; durable search-coverage rollout"
    },
    {
      "at": "2026-10-25T17:15:00+05:30",
      "by": "agent",
      "change": "broadened keyword queries to high-volume 1-3 word terms and expanded title filters across all 7 campaigns",
      "reason": "eliminate over-constrained 4-5 word AND queries and capture full AI/agent/RAG/MCP/automation demand"
    }
  ],
  "global": {
    "max_submits_per_day": 5,
    "target_submits_per_day": 3,
    "connects_budget_month": 250,
    "searches_per_pass": 12,
    "detail_fetches_per_pass": 10,
    "lookback_cap_hours": 72,
    "default_score_threshold": 70,
    "review_band_min": 55,
    "boost_max_connects": 10,
    "boost_min_score": 80,
    "priority_order": [
      "claude-implementation",
      "mcp-integrations",
      "ai-agents",
      "rag-knowledge",
      "n8n-automation",
      "integrations-repair",
      "ai-training-coaching"
    ],
    "exclude_terms": [
      "cold email",
      "deliverability",
      "gohighlevel",
      "clay",
      "apollo",
      "smartlead",
      "instantly",
      "linkedin outreach",
      "ios",
      "android",
      "unity",
      "solidity",
      "video editing",
      "data entry",
      "voice over"
    ]
  },
  "campaigns": [
    {
      "id": "claude-implementation",
      "priority": 1,
      "active": true,
      "queries": [
        "Claude",
        "Claude Code",
        "Anthropic",
        "Claude API",
        "Claude agent",
        "Claude workflow"
      ],
      "title_filters": [
        "Claude",
        "Anthropic"
      ],
      "subcategories": [
        "AI Apps & Integration"
      ],
      "fixed_floor": 250,
      "hourly_floor": 30,
      "max_drafts_per_day": 3,
      "connects_cap_per_day": 40,
      "score_threshold": 70,
      "rung_default": "sprint",
      "proof_cluster": "agent-mcp-engine|chatbot",
      "notes": "Highest fit, lowest pile-on cluster."
    },
    {
      "id": "mcp-integrations",
      "priority": 2,
      "active": true,
      "queries": [
        "MCP server",
        "Model Context Protocol",
        "Claude MCP",
        "custom MCP",
        "Cursor MCP"
      ],
      "title_filters": [
        "MCP"
      ],
      "subcategories": [
        "AI Apps & Integration"
      ],
      "fixed_floor": 500,
      "hourly_floor": 35,
      "max_drafts_per_day": 2,
      "connects_cap_per_day": 25,
      "score_threshold": 70,
      "rung_default": "implementation",
      "proof_cluster": "agent-mcp-engine",
      "notes": "High-intent niche with near-zero competition."
    },
    {
      "id": "ai-agents",
      "priority": 3,
      "active": true,
      "queries": [
        "AI agent",
        "LangGraph",
        "CrewAI",
        "autonomous agent",
        "LLM agent",
        "Python AI agent",
        "multi-agent"
      ],
      "title_filters": [
        "AI Agent",
        "LangGraph"
      ],
      "subcategories": [
        "AI Apps & Integration"
      ],
      "fixed_floor": 400,
      "hourly_floor": 35,
      "max_drafts_per_day": 2,
      "connects_cap_per_day": 30,
      "score_threshold": 70,
      "rung_default": "implementation",
      "proof_cluster": "agent-mcp-engine|scraping-warehouse",
      "notes": "Broad agentic engineering & workflow orchestration."
    },
    {
      "id": "rag-knowledge",
      "priority": 4,
      "active": true,
      "queries": [
        "RAG",
        "pgvector",
        "Supabase AI",
        "Cursor AI",
        "Lovable",
        "LLM evals",
        "knowledge base AI",
        "document Q&A"
      ],
      "title_filters": [
        "RAG",
        "Cursor",
        "Lovable"
      ],
      "subcategories": [
        "AI Apps & Integration"
      ],
      "fixed_floor": 400,
      "hourly_floor": 35,
      "max_drafts_per_day": 2,
      "connects_cap_per_day": 25,
      "score_threshold": 70,
      "rung_default": "audit",
      "proof_cluster": "chatbot|scraping-warehouse"
    },
    {
      "id": "n8n-automation",
      "priority": 5,
      "active": true,
      "queries": [
        "n8n",
        "n8n AI",
        "Make.com AI",
        "Zapier AI",
        "AI workflow automation"
      ],
      "title_filters": [
        "n8n"
      ],
      "subcategories": [
        "Scripting & Automation",
        "AI Apps & Integration"
      ],
      "fixed_floor": 250,
      "hourly_floor": 30,
      "max_drafts_per_day": 2,
      "connects_cap_per_day": 25,
      "score_threshold": 70,
      "rung_default": "sprint",
      "proof_cluster": "n8n-workflow|repair"
    },
    {
      "id": "integrations-repair",
      "priority": 6,
      "active": true,
      "queries": [
        "FastAPI LLM",
        "OpenAI API integration",
        "fix automation",
        "API integration Python",
        "Supabase backend"
      ],
      "title_filters": [
        "FastAPI",
        "OpenAI"
      ],
      "subcategories": [
        "Scripting & Automation",
        "AI Apps & Integration"
      ],
      "fixed_floor": 250,
      "hourly_floor": 30,
      "max_drafts_per_day": 1,
      "connects_cap_per_day": 15,
      "score_threshold": 70,
      "rung_default": "audit",
      "proof_cluster": "repair"
    },
    {
      "id": "ai-training-coaching",
      "priority": 7,
      "active": true,
      "queries": [
        "Claude training",
        "AI consulting",
        "AI coaching",
        "Cursor training"
      ],
      "title_filters": [],
      "subcategories": [],
      "fixed_floor": 250,
      "hourly_floor": 40,
      "max_drafts_per_day": 1,
      "connects_cap_per_day": 10,
      "score_threshold": 70,
      "rung_default": "sprint",
      "proof_cluster": "training",
      "notes": "Advisory, coaching, and team enablement."
    }
  ]
}
